article_url,article_title,idea_1,idea_2,idea_3,idea_4,idea_5,idea_6,idea_7
https://news.delta.com/make-most-middle-connecting-through-minneapolis-saint-paul,Make the most of the middle: Connecting through Minneapolis–Saint Paul,"Minneapolis–Saint Paul International Airport (MSP) serves as a major hub for Delta Air Lines, connecting travelers across the U.S. and internationally.","MSP features bright yellow wayfinding signage, wide corridors, and a tram system, making navigation intuitive and stress-free for travelers.","Travelers at MSP can enjoy a curated mix of shopping and dining options, including local brands and a Prince-themed store.","MSP's Delta Sky Club offers a variety of seating options and amenities, creating a relaxing environment for travelers before their next flight.","The Delta app provides timely notifications about boarding, enhancing the travel experience by keeping passengers informed.","The InterContinental Minneapolis–Saint Paul Airport connects directly to Terminal 1 via a skybridge, simplifying overnight connections for travelers.","MSP is designed to make layovers feel seamless and enjoyable, transforming the waiting period into a productive experience."
https://news.delta.com/inside-connection-detroit-metropolitan-airport,Inside a connection at Detroit Metropolitan Airport,"A traveler arrived at Detroit Metropolitan Airport with two hours between flights, allowing time for coffee and work while assessing the ease of the connection.","Detroit Metropolitan Airport's McNamara Terminal features tall windows for plane spotting, moving walkways for efficiency, and an ExpressTram that connects major gate clusters and Delta Sky Clubs.","A traveler enjoyed local food options at Detroit Metropolitan Airport, including Zingerman’s Coffee, 7greens for salads, and Buddy’s deep-dish pizza, creating a taste of Detroit without leaving the terminal.","The Delta Sky Club near Gate A43 provided a comfortable space for the traveler to work and relax, featuring modern seating and local artwork, along with direct access to The Westin Detroit Metropolitan Airport.","The traveler accomplished exploring, working, and dining within two hours at Detroit Metropolitan Airport, highlighting its efficiency and comfort as a connection hub.","Detroit Metropolitan Airport is designed to make layovers efficient, comfortable, and enjoyable, serving as more than just a transfer point for travelers.",
https://www.aviationtoday.com/2026/02/19/the-expensive-reality-of-ads-b-in-for-airlines/,The Expensive Reality of ADS-B In for Airlines,"Regulators have promoted Automatic Dependent Surveillance–Broadcast (ADS-B) In as a means to enhance airspace efficiency, but airlines are concerned about the associated costs and operational complexities of retrofitting their fleets.","ADS-B Out has been widely implemented, allowing aircraft to broadcast their position and intent, while ADS-B In, which enables aircraft to receive and display traffic and weather data, has seen slower adoption due to high retrofit costs.","For narrowbody aircraft like the A320neo and B737 MAX, the cost of upgrading to ADS-B In can range from $50,000 to $150,000 per aircraft, while widebody aircraft like the B777 and A350 face even higher costs due to their complex systems.","Short-haul airlines, such as Ryanair and Southwest, face significant challenges in retrofitting ADS-B In due to tight operational schedules that leave little downtime for aircraft maintenance.","Long-haul airlines benefit from more flexible scheduling for retrofits, but the integration of ADS-B In into complex avionics systems can lead to longer testing and certification processes.","The retrofit of ADS-B In is expected to be less invasive than a full avionics overhaul but more complex than simple connectivity upgrades, leading airlines to likely adopt a phased approach to implementation.",Airlines must balance the upfront costs and operational disruptions of retrofitting ADS-B In against the long-term benefits of improved efficiency and safety in air traffic management.
https://www.aviationtoday.com/2026/02/19/how-the-dca-disaster-hearing-is-reshaping-avionics-and-atc-rules/,How the DCA Disaster Hearing Is Reshaping Avionics and ATC Rules,The National Transportation Safety Board's January hearing on the Washington D.C. air crash disaster revealed significant gaps in avionics systems and air traffic control coordination that contributed to the crash.,"The hearing highlighted limitations in current air traffic control systems, including high-traffic congestion, limited radar coverage at Reagan National Airport, and inconsistent automated alerting mechanisms.",Avionics manufacturers are responding to the hearings by accelerating the development of predictive avionics software that can analyze multiple aircraft trajectories and provide earlier alerts to pilots.,"The NTSB's recommendations, although not enforceable, are expected to influence the Federal Aviation Administration to mandate enhanced conflict prediction and alerting systems in aircraft operating in high-density corridors.",The hearings have prompted a renewed focus on human factors training for pilots and air traffic controllers to ensure they understand the capabilities and limitations of sophisticated avionics.,Manufacturers and airlines are recognizing that public confidence in U.S. airspace safety requires demonstrable improvements in technology and operational practices following the DCA disaster.,"The DCA disaster is accelerating the integration of cockpit technology and air traffic control modernization, aiming for a safety ecosystem where human expertise and technology work together to prevent future tragedies."
https://www.aviationtoday.com/2026/02/19/how-supply-chain-breakdowns-are-clouding-the-future-of-avionics/,How Supply Chain Breakdowns Are Clouding the Future of Avionics,,,,,,,
https://www.aviationtoday.com/2026/02/19/startup-developing-blended-wing-aircraft-for-cargo-use-raises-28-million/,Startup Developing Blended Wing Aircraft For Cargo Use Raises $28 Million,"Natilus, a startup focused on developing blended-wing aircraft for cargo and passenger applications, raised $28 million in an early funding round on February 10, 2026, to finish manufacturing the first full-scale prototype of its KONA regional cargo plane, which is expected to fly within two years.","Natilus' KONA regional cargo aircraft has a range of 900 nautical miles and can carry a payload of 3.8 metric tons, and it could support the Air Force’s Agile Combat Employment and logistics supply in contested environments like the Indo-Pacific region.","Natilus is targeting 2029 to bring the KONA aircraft to market and has performed successful wind tunnel and subscale prototype testing, receiving a patent for the aircraft’s diamond-shaped cargo bay.","The funding will also support the development of HORIZON EVO, a 200-plus passenger aircraft that Natilus plans to compete with the Boeing 737 MAX and Airbus A321neo, transitioning its design from a single-deck to a dual-deck aircraft.","Natilus has a combined order book exceeding 570 aircraft worth $24 billion for both the KONA and EVO, with most orders for the KONA aircraft from companies like Nolinor Aviation, Flexport, and Ameriflight.",Natilus states that its blended-wing aircraft design reduces fuel usage by 30 percent and carbon emissions and operational costs by 50 percent.,"The funding round for Natilus included participation from investors such as Type One Ventures, The Veterans Fund, Flexport, New Vista Capital, Soma Capital, Liquid 2 VC, VU Venture Partners, and Wave FX."
https://www.aviationtoday.com/2026/02/19/usaf-to-award-sole-source-contract-to-bae-systems-to-resolve-deficiency-reports-on-alr-56/,USAF To Award Sole Source Contract To BAE Systems To Resolve Deficiency Reports on ALR-56,,,,,,,
https://www.aviationtoday.com/2026/02/19/use-of-commercial-technologies-obviates-need-for-c-17-re-engining-usaf-says/,"Use of Commercial Technologies Obviates Need for C-17 Re-engining, USAF Says",,,,,,,
https://skift.com/2026/02/19/the-hotel-industry-wasnt-built-for-this-nothing-was/,The Hotel Industry Wasn’t Built for This. Nothing Was.,,,,,,,
https://skift.com/2026/02/20/ennismore-ceo-lines-up-more-india-deals-after-mumbai-debut/,Ennismore CEO Plans More India Hotels After Mumbai Debut,,,,,,,
https://skift.com/2026/02/20/expedia-ai-agentic-10k-earnings-q4-2025/,What Expedia Says About the Coming Agentic Travel Fight,"Expedia Group's annual report for 2026 identifies agentic artificial intelligence as a significant competitive threat, highlighting risks from new AI-driven competitors and data scraping.",Expedia's 10-K report identifies the rapid emergence of generative and agentic AI as a significant threat that is likely to intensify competition in the travel industry.,Expedia executives stated during an earnings call that the company is aggressively experimenting with AI to enhance its visibility and relevance in the market.,Expedia is focusing on protecting its proprietary pricing and inventory data from potential AI scraping threats.,"Expedia's internal AI improvements have led to increased efficiency and advertising revenue, although the company acknowledges it may lag behind competitors in advanced agentic features.","Expedia's consumer-facing agentic AI offerings are still in early development stages, with plans to enhance natural language booking capabilities.",
https://skift.com/2026/02/19/sabre-layoffs-leadership-changes-ai-native/,Sabre Lays Off Staff Amid C-Suite Reshuffle in Bid to Become ‘AI-Native’,,,,,,,
https://skift.com/2026/02/19/las-vegas-tourism-suffers-sharp-decline/,Las Vegas Tourism Suffers Sharp Decline,"Las Vegas tourism experienced a 7.5% decline in visitor arrivals in 2025, marking the worst year since the pandemic and the sharpest drop outside a pandemic year since record-keeping began in 1970, with approximately 3.1 million visitors.","Las Vegas' hotel industry experienced declines in 2025, with annual hotel occupancy down 3.3 percentage points and average daily rates dropping 5%.","The decline in Las Vegas tourism was significantly influenced by decreased travel from Canada and reduced airline capacity, particularly from Spirit Airlines and Canadian carriers.","Despite the downturn in 2025, recent data indicates early signs of stabilization in Las Vegas tourism and an increase in tradeshow attendance as the city approaches 2026.",,,
https://skift.com/2026/02/19/choice-hotels-purge-sheds-weak-properties-to-lift-brand-quality/,Choice Hotels’ Purge: Sheds Weak Properties to Lift Brand Quality,"Choice Hotels reduced its net U.S. room count by 2.9% last year by intentionally removing underperforming hotels while adding higher quality properties, according to president and CEO Pat Pacious.","Choice Hotels ended the year with 496,979 rooms in the U.S. and a total of 656,825 rooms globally, reflecting a 1% net increase due to international expansion.",Choice Hotels' strategy of shedding lower-margin budget hotels in favor of higher-fee hotels is expected to enhance brand quality and profitability.,The slower pace of new hotel construction in the U.S. contributed to the net decline in U.S. rooms for Choice Hotels.,Choice Hotels anticipates that its shift toward a more premium portfolio will lead to modest earnings growth through 2026.,"Choice Hotels is monitoring economic trends and consumer spending factors, such as tax refunds, that could impact its future performance.",
https://skift.com/2026/02/19/u-s-inbound-tourism-slump-deepens/,U.S. Inbound Tourism Slump Deepens to Start 2026,"U.S. inbound tourism fell for the ninth consecutive month in January 2026, with a 4.2% decline in overseas visitors compared to the previous year, as reported by the National Travel and Tourism Office.","Significant drops in inbound tourism were recorded from key markets, including double-digit decreases from Asia, Africa, and Oceania, as well as steep declines from countries like China and India.","A proposed requirement for Visa Waiver Program travelers to disclose five years of social media history could further deter visitors to the U.S., potentially costing the U.S. travel sector billions in lost spending.",,,,
https://skift.com/2026/02/19/air-france-klm-hits-e2-billion-profit-milestone-as-premium-anchors-outlook/,Air France-KLM Hits €2 Billion Profit Milestone as Premium Anchors Outlook,"Air France-KLM achieved a record €2 billion ($2.4 billion) in annual operating profit for the first time, driven by strong transatlantic demand and sustained strength in premium travel.","Air France-KLM's annual operating profit represented a €400 million improvement from the previous year, leading to a significant increase in the airline's shares.",Air France-KLM executives stated that North Atlantic routes are the airline's strongest performers despite geopolitical tensions and concerns about inbound U.S. tourism trends for 2026.,"Air France-KLM reported stronger yields across its premium cabins, which helped offset weaker pricing in European economy markets.","Air France-KLM Group CEO Ben Smith emphasized that U.S. point-of-sale demand is a key strength for the airline, while noting that changes in travel behavior have not yet been reflected in the company's booking data.","KLM, as part of the Air France-KLM Group, faces structural challenges due to rising costs and operational disruptions, while Air France benefits from premium investments.","Major European airlines, including Iberia and Lufthansa, are expanding their transatlantic offerings in response to sustained demand from U.S. travelers."
https://skift.com/2026/02/18/heres-how-u-s-airlines-say-theyre-using-ai/,Here’s How U.S. Airlines Say They’re Using AI,"Major U.S. airlines including Delta Air Lines, United Airlines, and Southwest Airlines are increasingly disclosing their use of artificial intelligence in annual reports, applying it to areas such as baggage handling, marketing, and operational efficiency.",Delta Air Lines is using artificial intelligence to help route and distribute bags for flights with short connecting times and to improve on-time performance.,United Airlines has linked its adoption of artificial intelligence to management job cuts and has highlighted both the benefits and ethical challenges associated with the technology.,"Southwest Airlines is approaching artificial intelligence integration differently compared to other carriers, focusing on operational and marketing improvements.","Airlines are expressing caution regarding the risks of artificial intelligence, including potential cybersecurity threats and reputational harm, and are taking steps to ensure ethical and compliant integration of the technology.",,
https://skift.com/2026/02/18/navan-to-replace-cfo-4-months-after-ipo/,Navan to Replace CFO 4 Months After IPO,,,,,,,
https://airlinegeeks.com/2026/02/20/united-american-to-inject-200-million-into-brazils-azul/,"United, American to Inject $200 Million into Brazil’s Azul",United Airlines and American Airlines have each committed $100 million to recapitalize the struggling Brazilian carrier Azul once it emerges from Chapter 11 bankruptcy protection.,"Azul will receive an additional $100 million investment from its existing creditors, bringing the total new capital to $300 million.",The funds from United Airlines and American Airlines are intended to strengthen Azul's capital structure and support its operations after exiting bankruptcy.,"Azul, headquartered near São Paulo, serves numerous destinations within Brazil and offers medium- and long-haul service to countries including Argentina, Paraguay, Uruguay, and the United States.","Azul filed for bankruptcy in 2025 due to rising costs, and its reorganization plan is being overseen by the U.S. Bankruptcy Court for the Southern District of New York.","In December 2025, the U.S. Bankruptcy Court approved Azul's debt restructuring, allowing the airline to raise capital from United Airlines, American Airlines, and other investors.",
https://airlinegeeks.com/2026/02/19/american-picks-leap-engines-for-future-a321neo-deliveries/,American Picks LEAP Engines for Future A321neo Deliveries,American Airlines has selected CFM International's LEAP-1A engine to power 85 new Airbus A321neo aircraft ordered in early 2024.,"American Airlines already uses LEAP engines on its in-service Airbus A321neos, A321XLRs, and Boeing 737 MAX aircraft.",American Airlines CEO Robert Isom stated that the airline is proud to operate more CFM/GE Aerospace-powered aircraft than any other airline in the world.,CFM International will provide long-term maintenance for American Airlines' LEAP-1A engines.,"American Airlines has options for an additional 116 Airbus A320-family aircraft, which would also be outfitted with LEAP engines if the options are exercised.",,
https://airlinegeeks.com/2026/02/19/israel-to-add-another-international-airport/,Israel to Add Another International Airport,"The government of Israel has approved the construction of a new international airport in the Ziklag area of the southern Negev region, which will be developed simultaneously with another new airport in Ramat David in northern Israel.","The primary motivation for constructing the new airports is to alleviate severe congestion at Tel Aviv's Ben Gurion International Airport, which is nearing its maximum capacity of 40 million passengers per year.","The Ziklag airport project was initially rejected due to concerns about its proximity to the Gaza border and potential interference with military flight paths, but defense officials have since deemed these concerns manageable.",,,,
https://airlinegeeks.com/2026/02/18/jetblue-flight-reports-engine-failure-returns-to-airport/,"JetBlue Flight Reports Engine Failure, Returns to Airport","A JetBlue flight departing Newark, New Jersey, for West Palm Beach, Florida, experienced engine failure and was forced to return to Newark Airport on February 18, 2026.","Upon landing, the crew of the JetBlue flight reported smoke in the cockpit and evacuated passengers using inflatable slides, with no injuries reported.","The incident caused a temporary ground stop for flights at Newark Airport, but operations resumed by 7:10 p.m.",,,,
https://airlinegeeks.com/2026/02/20/air-canada-adds-new-route-flights-to-mexico/,"Air Canada Adds New Route, Flights to Mexico","Air Canada is significantly expanding its service to Mexico this summer by introducing a new nonstop route from Montreal to Guadalajara and increasing flight frequencies on existing routes to Cancun, Monterrey, Mexico City, and Puerto Vallarta.","The new Montreal-Guadalajara route will launch on June 2 and operate three times weekly year-round, with flights scheduled on Tuesdays, Thursdays, and Saturdays, and return flights from Guadalajara on Wednesdays, Fridays, and Sundays.","Air Canada will increase its flight frequency from Montreal to Cancun from seven times weekly to 11 times weekly, from Toronto to Monterrey from three times weekly to four times weekly, from Vancouver to Mexico City from seven times weekly to 11 times weekly, and from Vancouver to Puerto Vallarta from once weekly to twice weekly.","Mark Galardo, Air Canada’s executive vice president, chief commercial officer, and president of cargo, emphasized that air travel promotes tourism, trade, and connectivity, highlighting Mexico's role in Air Canada’s broader Latin America strategy for enhancing efficient passenger and cargo connections.","Air Canada announced an interline partnership with Pegasus Airlines that will allow passengers to connect to various destinations in Turkey on a single itinerary through eight European gateways, including Amsterdam, Copenhagen, Frankfurt, Munich, Geneva, Vienna, Zurich, and Athens.","Passengers will also have access to a Pegasus connection from Frankfurt to Izmir, Turkey, located on the Aegean coast of Anatolia.",
https://airlinegeeks.com/2026/02/18/allegiant-plans-dolly-parton-themed-flight-to-knoxville/,Allegiant Plans Dolly Parton-Themed Flight to Knoxville,"Allegiant Air is launching a special one-off flight named Flight 925 on November 6, connecting Orlando Sanford International Airport in Florida to Knoxville, Tennessee, to celebrate Dolly Parton and her theme park, Dollywood.",Flight 925 is named after Dolly Parton's hit song '9 to 5' and is scheduled to coincide with Dollywood's Smoky Mountain Christmas festival.,"Allegiant Air is partnering with Dollywood to provide Flight 925 passengers with unique themed experiences, including treats, exclusive merchandise, and park perks at the gate, during the flight, and at Dollywood.","Flight 925, operated by Allegiant, aims to embrace the joy of travel and create unforgettable moments for passengers through a partnership with Dollywood.","Dollywood, located in Pigeon Forge, is recognized as the most popular ticketed attraction in Tennessee.",,
https://airlinegeeks.com/2026/02/18/delta-flight-returns-to-airport-after-passenger-disturbance/,Delta Flight Returns to Airport After Passenger Disturbance,A Delta Airlines flight from Houston Hobby to Atlanta was forced to return shortly after takeoff due to an unruly passenger who exhibited disruptive behavior toward other customers.,"Houston police detained a passenger at Gate 32 after a Delta flight returned due to the individual's unruly behavior, but specific charges against the passenger were not immediately clear.","A pilot informed air traffic controllers that a passenger attempted to access the cockpit, but Delta Airlines clarified that the passenger's behavior was directed at other customers and did not involve the flight deck.",Delta Airlines apologized to customers for the delay caused by an incident involving an unruly passenger and emphasized its zero-tolerance policy for such behavior.,,,
https://airlinegeeks.com/2026/02/18/investigators-provide-update-on-toronto-endeavor-air-crash/,Investigators Provide Update on Toronto Endeavor Air Crash,"The Transportation Safety Board of Canada (TSB) is investigating the February 2025 crash of Endeavor Air flight 4819 at Toronto Pearson International Airport, where the CRJ-900's right wing detached and the aircraft inverted upon landing, injuring 21 people.","TSB investigators are conducting extensive work, including metallurgical examinations of key wreckage parts, analysis of onboard recorder data, air traffic control information, and meteorological conditions related to the crash.","The Transportation Safety Board of Canada (TSB) reported that the CRJ-900 aircraft had a high rate of descent of 1,110 feet per minute and a 7.1-degree right bank angle before touchdown, which caused the right landing gear to fracture and the wing to detach.","Key parts of the wreckage, including the right wing and landing gear, were sent for further testing at the TSB’s Engineering Laboratory in Ottawa after being brought to a hangar at Toronto Pearson International Airport.","Investigators from the Transportation Safety Board of Canada (TSB) are conducting exercises at Endeavor Air’s training facility as part of the ongoing investigation into the February 2025 crash of Endeavor Air flight 4819, and after completing their analysis, the TSB will draft a report for key stakeholders to review before publishing a final report.","The accident on February 17, 2025, involved a CRJ-900 aircraft operating as a Delta Connection flight from Minneapolis-St. Paul, which crashed upon landing, resulting in injuries to 21 people while all 80 passengers and crew survived and were evacuated.",Multiple lawsuits have been filed against Delta and Endeavor Air in relation to the February 2025 crash of flight 4819.
https://airlinegeeks.com/2026/02/18/united-nigeria-eyes-nonstop-flights-to-the-u-s/,United Nigeria Eyes Nonstop Flights to the U.S.,United Nigeria Airlines plans to launch nonstop flights to New York in the second quarter of 2026 as part of its international expansion strategy.,"United Nigeria Airlines will introduce new routes to Europe, the U.K., and the Middle East by summer 2026, as stated by Chairman Obiora Okonkwo.",United Nigeria Airlines is upgrading its fleet by acquiring six Boeing 737-800s and leasing two Airbus A330s to support its planned international routes.,"United Nigeria Airlines currently operates flights within Nigeria and to Accra, Ghana, and is considering regional routes to Dakar, Monrovia, and Johannesburg.","Within three to five years, United Nigeria Airlines intends to be listed on the Nigerian Stock Exchange.",,
https://airlinegeeks.com/2026/02/18/porter-adds-new-u-s-destination-2/,Porter Adds New U.S. Destination,"Porter Airlines is launching its first service to Texas, with flights between Toronto Pearson and Austin starting on May 21, operating five times weekly using an Embraer E195-E2 aircraft.","Porter Airlines is relocating its Chicago operations from Midway to O'Hare on September 1, increasing flight frequency to three times daily and providing more connecting options for passengers.","Porter Airlines has connected Billy Bishop Toronto City Airport with Midway since 2008, but will switch to O'Hare to enhance passenger access to partner carriers.","Porter Airlines is expanding its destinations and flights to meet traveler demand for more options and elevated service, according to Andrew Pierce, Porter’s vice president of network planning and reporting.","Porter Airlines is introducing a new seasonal route connecting Ottawa and Deer Lake, with flights starting on June 10 and operating five times weekly.",,
