article_url,article_title,idea_1,idea_2,idea_3,idea_4,idea_5,idea_6,idea_7
https://airlinegeeks.com/2026/02/18/jetblue-resumes-texas-route/,JetBlue Resumes Texas Route,"JetBlue Airways will resume nonstop service between Houston and New York-JFK starting on May 21, 2026, operating twice daily with Airbus A320 aircraft.",JetBlue last served the Houston to New York-JFK route in February 2025 and has continued to connect Houston with its Boston hub.,"Dave Jehn, vice president of network planning and airline partnerships at JetBlue, stated that Houston is an important destination and the reintroduction of nonstop service provides convenient connections between the two major metropolitan areas.",Tickets for the new Houston to New York-JFK route are now available for purchase.,,,
https://airlinegeeks.com/2026/02/19/vietnam-airlines-orders-50-boeing-737-max-jets/,Vietnam Airlines Orders 50 Boeing 737 MAX Jets,"Vietnam Airlines finalized its first order for 50 Boeing 737 MAX 8 aircraft, marking the airline's first acquisition of single-aisle Boeing jets.","Vietnam Airlines aims to modernize its fleet, enhance fuel efficiency, reduce costs, and expand capacity to support new routes and meet projected growth in Vietnamese air traffic.","Vietnam Airlines Chairman Dang Ngoc Hoa announced that the investment in 50 Boeing 737-8 aircraft will modernize the fleet, enhance fuel efficiency, reduce costs, and elevate service standards to meet international benchmarks.",The integration of the 737 MAX is expected to help Vietnam Airlines reduce costs while building capacity and supporting new routes.,Vietnam's air traffic is projected to double to more than 75 million annual passengers over the next 10 years.,"Vietnam Airlines mainly operates flights to destinations in East and South Asia and serves one destination in the U.S., which is San Francisco.",
https://airlinegeeks.com/2026/02/19/psa-flight-attendants-reach-tentative-labor-agreement/,"PSA, Flight Attendants Reach Tentative Labor Agreement","PSA Airlines and its flight attendants, represented by the Association of Flight Attendants-CWA, have reached a tentative three-year labor agreement that includes an immediate 10% wage increase and other benefits.","The proposed labor agreement for PSA flight attendants includes retro pay, additional wage scale raises, scheduling improvements, increased flexibility, and pay for boarding, which will add 15% to 16% to compensation on average.","If ratified by flight attendants in a vote closing on March 6, the tentative agreement is projected to result in a 30% to 50% increase in overall compensation over its lifespan.","Lee Wilkes, president of the AFA master executive council at PSA, emphasized that the tentative agreement acknowledges the essential role of flight attendants in maintaining passenger safety.","Sara Nelson, the AFA International President, thanked American Airlines CEO Robert Isom for his engagement in making the labor agreement possible.","Robert Isom has faced criticism from pilots and flight attendants regarding earnings results reported in January, despite expectations of higher earnings per share starting in 2026.",
https://airlinegeeks.com/2026/02/19/faa-easa-qualify-boeing-777-9-flight-simulator/,"FAA, EASA Qualify Boeing 777-9 Flight Simulator","A flight simulator for the Boeing 777-9, developed by Boeing and CAE, has received initial qualification certificates from the FAA and EASA, moving it closer to final approval for pilot training.","The flight simulator, located in Gatwick, England, will be used by regulators to validate training courseware before airlines begin preparing pilots for the Boeing 777-9.","Captain Gary Mandy, the chief technical pilot for the 777X program, emphasized that securing approvals from the FAA and EASA is crucial for initiating flight training.","The Boeing 777-9's flight deck is designed for comfort and commonality with the 787 Dreamliner, featuring large-format touchscreen displays and dual head-up displays.","Boeing expects the first flight of a production Boeing 777X to take place in April, despite previous delays mainly due to technical issues.","Boeing is targeting early 2027 for the delivery of the first Boeing 777-9 to Lufthansa, the type’s launch client.",
https://skift.com/2026/02/19/united-shakes-up-mileageplus-heres-whats-changing/,United Shakes Up MileagePlus: Here’s What’s Changing,"United Airlines is overhauling its MileagePlus loyalty program to provide more rewards to customers who hold the airline's co-branded credit cards, aiming to attract high-spend travelers.","Starting April 2, 2026, customers who purchase tickets with a United credit card will earn twice the amount of miles per dollar spent on flights compared to non-cardholders.","Only customers who hold a United credit card will earn miles on basic economy tickets, marking a significant change in the airline's policy.","United Airlines credit cardholders will receive at least a 10% discount on award flights, with larger discounts and more Saver Award seat access available for top-tier members.",These changes in the MileagePlus program reflect a broader industry trend of airlines rewarding high-spend and premium travelers while increasing annual fees and enhancing perks.,,
https://airlineweekly.skift.com/2026/02/american-airlines-is-falling-behind-heres-why/,American Airlines Is Falling Behind. Here’s Why,"Delta Air Lines and United Airlines are dominating airline profits while American Airlines is falling behind, and Frontier Airlines is struggling to recover.",,,,,,
https://runwaygirlnetwork.com/2026/02/iridium-eyes-aviation-disruption-with-certus-safety-and-space-based-vhf/,"Iridium plans aviation disruption with Certus safety, space-based VHF","Iridium plans to disrupt the aviation industry with its next-generation Certus satellite communication service, which is currently undergoing flight trials to support aircraft safety services.","Iridium's legacy service supports controller-to-pilot data links and cockpit communications on over 60,000 aircraft globally, while its Aireon joint venture powers a global space-based ADS-B flight tracking service.",Iridium CEO Matthew Desch announced that several aircraft are now equipped with the necessary avionics for Certus and are participating in flight trials to gather data for Federal Aviation Administration approval.,"Iridium expects to receive final clearance from the Federal Aviation Administration for Certus to support the Future Air Navigation System, which is essential for direct datalink communications over oceans.","Iridium's Certus AvSafety product will compete with Viasat's SwiftBroadband-Safety product, and Iridium CEO Matthew Desch stated that the company could potentially take traffic back from the terrestrial network through Aireon's space-based VHF initiative.","Iridium's partnership with Aireon is a crucial element of its strategy to expand in the aviation safety market, transitioning from ground-based VHF data transmission to more efficient satellite-based solutions.","Iridium is also focusing on evolving standards for Uncrewed Aerial Systems and pursuing growth in narrowband IoT, positioning, navigation and timing services, and national security projects with the U.S. government."
https://runwaygirlnetwork.com/2026/02/optimism-abounds-as-amazon-eyes-third-party-antenna-option-for-leo/,Optimism abounds as Amazon eyes more open ecosystem for LEO,,,,,,,
https://runwaygirlnetwork.com/2026/02/sun-phuquoc-airways-orders-up-to-40-boeing-787s/,Press Release: Sun PhuQuoc Airways orders up to 40 Boeing 787s,"Sun PhuQuoc Airways, a new Vietnam-based airline, has ordered up to 40 Boeing 787 Dreamliner jets to serve as the backbone of its widebody fleet.","Dang Minh Truong, chairman of Sun Group, stated that the partnership with Boeing will help build a world-class airline that aligns with the tourism ecosystem developed by Sun Group.","The Boeing 787-9 Dreamliner has a range of 7,565 nautical miles and will enable Sun PhuQuoc Airways to connect Phu Quoc with major cities and tourist destinations across Asia, Europe, and North America.","Stephanie Pope, president and CEO of Boeing Commercial Airplanes, expressed excitement about Sun PhuQuoc Airways joining other global airlines in operating the 787 Dreamliner, highlighting its range, fuel efficiency, and passenger comfort.","Since the introduction of the Boeing 787 Dreamliner family in 2011, it has helped launch over 535 new nonstop routes and carried more than 1.2 billion passengers worldwide.","Vietnam is projected to be the fastest-growing aviation market in Southeast Asia, with an expected annual passenger growth of nearly 8% by 2030.",Sun PhuQuoc Airways aims to expand its fleet to 100 aircraft by 2030 to meet the rising demand for premium tourism and contribute to the growth of Phu Quoc and Vietnam.
https://runwaygirlnetwork.com/2026/02/retrofit-lufthansa-a320-with-new-cabin/,Press Release: New cabins come to Lufthansa A320 continental fleet,Lufthansa Airlines is modernizing its A320 continental fleet to enhance passenger comfort and experience on short- and medium-haul flights.,"A total of 38 Airbus A320 aircraft have been retrofitted with new seats from manufacturer Geven, larger overhead bins, and USB-A and USB-C power ports at every seat.","Lufthansa Airlines aims to provide a premium experience on short- and medium-haul routes by investing in the modernization of its largest fleet, the A320 family, according to CEO Jens Ritter.","The first fully modernized Airbus A320, registered as 'D-AIZY', has been back in service since mid-February 2026, with plans to convert 38 A320s by 2029.","The retrofit process for each aircraft takes approximately 30 days and involves the installation of around 1,000 different components from approximately 100 suppliers.","The new ergonomically designed seats from Geven provide enhanced comfort, featuring horizontally adjustable headrests and a reclining backrest in Business Class.","The new overhead bins are 40 percent larger, allowing for more efficient boarding and increased space for carry-on luggage."
https://thepointsguy.com/credit-cards/best-card-pairings-amex-gold/,7 of the best cards to pair with the Amex Gold,"The American Express® Gold Card has a $325 annual fee and is recommended to be paired with another card to access additional bonus categories, statement credits, or hotel elite status.",Pairing the American Express Gold Card with other Membership Rewards points-earning cards allows users to pool points into one Membership Rewards account for better redemption options.,"The American Express Platinum Card® offers a welcome bonus of up to 175,000 bonus points after spending $12,000 in the first six months and provides travel perks like lounge access and elite status with Marriott and Hilton.","The Blue Cash Everyday® Card from American Express has no annual fee and offers 3% cash back on groceries, U.S. online retail purchases, and U.S. gas stations, making it a good partner for the Amex Gold.","The Blue Cash Preferred® Card from American Express offers a welcome bonus of up to $300 cash back after spending $3,000 in the first six months and provides 6% cash back on groceries and select streaming services.","The Delta SkyMiles® Gold American Express Card offers up to 90,000 bonus miles and benefits like a free checked bag and priority boarding for frequent Delta flyers.","The Capital One Venture Rewards Credit Card provides a welcome bonus of 75,000 bonus miles after spending $4,000 in the first three months and earns 2 miles per dollar on all purchases, making it a versatile option."
https://thepointsguy.com/cruise/expedition-cruises-ultimate-guide/,"Expedition cruises: The ultimate guide to cruising to remote, hard-to-reach places",Expedition cruising is a rapidly growing sector of the cruise industry that focuses on traveling to remote locations like Antarctica on specialized vessels.,"Unlike traditional cruises that emphasize shipboard activities and resort-like experiences, expedition cruises prioritize access to off-the-beaten-path destinations with little or no land-based infrastructure.","Expedition cruises often involve unpredictable daily activities determined by wildlife movements, weather conditions, and ice conditions, making each journey unique and adventurous.","Typical expedition cruise ships are smaller and more agile than traditional cruise ships, equipped with strengthened hulls for ice navigation and adventure gear for exploring remote areas.",An expedition cruise is staffed by an expedition team that includes leaders and scientific experts who provide insights and guidance during landings and onboard lectures.,"Popular expedition cruise destinations include Antarctica and the Arctic, which are challenging to access by other means and offer unique wildlife and scenic experiences.","Expedition cruises can be expensive, often costing $1,000 or more per person per day, reflecting the specialized nature of the vessels and the high staff-to-passenger ratio."
https://thepointsguy.com/credit-cards/is-delta-reserve-amex-worth-annual-fee/,Is the Delta Reserve Amex worth the annual fee?,"The Delta SkyMiles® Reserve American Express Card is the most premium Delta Air Lines cobranded card from American Express, featuring benefits like airport lounge access and upgrade priority, but it comes with a $650 annual fee.","New Delta SkyMiles Reserve cardmembers can earn up to 125,000 bonus miles by spending $9,000 within the first six months of card membership, with the offer ending on April 1, 2026.","The Delta SkyMiles Reserve card earns Delta miles at rates of 3 miles per dollar spent on Delta purchases and 1 mile per dollar spent on other purchases, translating to a return of approximately 3.8% and 1.3% respectively.","Delta SkyMiles Reserve cardmembers earn 1 Medallion Qualification Dollar for every $10 spent, along with a bonus of 2,500 MQDs each Medallion Qualification Year, facilitating faster qualification for Medallion status.",Delta SkyMiles Reserve cardmembers can receive up to $10 monthly in statement credits for eligible ride-hailing services and up to $20 monthly in statement credits for eligible purchases at U.S. Resy restaurants.,"Delta SkyMiles Reserve cardmembers receive a companion certificate annually after renewal, allowing them to buy two round-trip tickets for the price of one, plus taxes and fees, which can offset the annual fee.","The Delta SkyMiles Reserve card provides a 15% discount on Delta-operated award flights booked with SkyMiles, potentially saving cardmembers thousands of miles annually."
https://thepointsguy.com/deals/points-and-miles-travel-deals/,Deal alert: Points and miles travel deals for February 2026,Rachel Craft is a travel writer at TPG who aims to help people maximize their points and miles for travel.,"In February 2026, flights to Jamaica can be booked for only 8,000 American Airlines AAdvantage miles, and IHG is offering a 25% discount on stays worldwide.","Alaska Airlines is running a Global Getaways sale with up to 60% savings on award flights to select destinations, including tickets to Helsinki starting at 17,500 Atmos Rewards points one-way.",Singapore Airlines KrisFlyer is offering a Spontaneous Escapes promotion that can save travelers up to 30% on Saver award rates for flights in March 2026.,"Best Western Rewards members can earn 1,500 bonus points for each stay at participating hotels in Central Europe if they register and stay by March 31, 2026.","Radisson Rewards members can earn up to 7,000 bonus points this spring by completing multiple stays by April 9, 2026.","American Express is offering targeted promotions for cardholders, including cash back on purchases at mountain resorts and discounts on Singapore Airlines flights."
https://thepointsguy.com/loyalty-programs/how-to-get-ihg-fourth-night-free-award/,How to get your fourth reward night free when redeeming IHG points,,,,,,,
https://thepointsguy.com/news/delta-credit-card-award-discount/,How to use and maximize Delta’s TakeOff 15 feature to save on award tickets,Delta Air Lines offers a TakeOff 15 benefit that provides a 15% discount on all award flights for holders of eligible cobranded American Express cards.,"Eligible Delta cobranded American Express cards for the TakeOff 15 discount include the Delta SkyMiles® Gold, Platinum, and Reserve cards, among others, while the Delta SkyMiles® Blue card is not eligible.","To utilize the TakeOff 15 discount, Delta Air Lines customers must pay the taxes and fees with their eligible Delta cobranded American Express card when booking award flights.","The TakeOff 15 discount applies only to Delta-operated flights and does not apply to Pay with Miles, Miles + Cash purchases, or upgrades purchased after ticketing.",Delta Air Lines customers can potentially save on previously booked award flights by rebooking if the price has dropped due to the TakeOff 15 feature.,"Delta Air Lines will refund both miles and fees immediately after a customer cancels a ticket to rebook at a lower price, except for non-refundable basic economy award tickets.","The TakeOff 15 benefit allows eligible Delta cobranded cardholders to save hundreds of dollars in SkyMiles annually, with no limit on how many times the benefit can be used."
https://thepointsguy.com/travel/best-spring-break-getaways-us/,11 best spring break destinations in the US,"Monterey, California, is a marine science destination featuring the Monterey Bay Aquarium, where visitors can see sea otters, sharks, and penguins, and participate in events like sea otter feedings.","Lake City, Florida, is home to over 900 freshwater springs and offers activities like tubing and kayaking at Ichetucknee Springs State Park, as well as historical tours in nearby St. Augustine.","New York's Finger Lakes region provides opportunities for hiking, biking, and wine tasting, with attractions like Watkins Glen State Park and the Women's Rights National Historical Park.","Oregon's Willamette Valley is known for its pinot wines and outdoor activities, including hiking to waterfalls and cycling along the Willamette Valley Scenic Bikeway.","Tucson, Arizona, recognized as a UNESCO City of Gastronomy, offers a blend of cultural experiences and outdoor activities, including the Agave Heritage Festival celebrating local cuisine and culture.","Maui, Hawaii, is a prime whale watching destination during spring, with opportunities to see humpback whales and enjoy various beach activities along its coastline.","Moab, Utah, serves as a base for exploring Arches and Canyonlands national parks, offering mountain biking trails and river rafting adventures."
https://thepointsguy.com/news/national-parks-reservation-requirement-2026/,3 popular national parks scrap reservation systems ahead of peak season,,,,,,,
https://thepointsguy.com/credit-cards/choose-right-credit-card-for-your-business/,How to choose the best credit card for your business expenses,"Chris Nelson is a credit cards writer for TPG, specializing in budget travel, hotels, earning elite status through minimal spending, and redeeming points for maximum value.",Augusta Stone is a credit cards writer for TPG who joined the team in 2023 and aims to help points and miles beginners maximize rewards.,"Running a business or side hustle involves various expenses, and selecting the right business credit card can optimize spending on office supplies, advertising, travel, and everyday expenses.","The Business Platinum Card® from American Express offers 200,000 bonus points after spending $20,000 on eligible purchases within the first three months of card membership.","The Capital One Venture X Business card provides an annual $300 Capital One Business Travel credit, 10,000 bonus miles each year, and earns at least 2 miles per dollar spent on every purchase.","The Ink Business Preferred Credit Card is designed for business owners who spend significantly on travel and advertising, offering 3 points per dollar spent on the first $150,000 in combined spending annually.",The United Business Card provides 7 miles per dollar spent on United Airlines flight purchases and includes perks like free checked bags and priority boarding.
https://thepointsguy.com/loyalty-programs/current-transfer-bonuses/,"Credit card transfer bonuses (February): 40% bonus to Virgin Flying Club, 30% bonus to JAL and more","Chase Ultimate Rewards is currently offering a 40% transfer bonus to Virgin Atlantic Flying Club and a 50% transfer bonus to Marriott Bonvoy, both expiring on February 28, 2026.","Capital One is providing a 30% transfer bonus to Japan Airlines Mileage Bank until February 28, 2026, allowing users to earn 975 JAL miles for every 1,000 Capital One miles transferred.",American Express Membership Rewards is not currently offering any transfer bonuses.,"Citi ThankYou Rewards currently does not offer any transfer bonuses, and only specific Citi cards provide the full 1:1 transfer ratio.",Marriott Bonvoy does not currently offer any transfer bonuses to airline partners.,"Rove Miles is not offering a transfer bonus but allows users to earn transferable miles through its rewards program, which includes up to 54 miles per dollar spent on select hotels.","Points or miles should only be transferred if there is a short-term plan for their use, as transfers are irreversible and should be based on specific redemption opportunities."
https://thepointsguy.com/cruise/best-antarctica-luxury-trips/,6 ways to travel to Antarctica in style and luxury,"Traveling to Antarctica has evolved from rough experiences on spartan ships to luxurious voyages offered by high-end cruise companies, provided travelers are willing to pay the steep costs associated with such trips.","Silversea Cruises operates high-end sailings to Antarctica on three vessels, including the 220-passenger Silver Endeavour, and offers a Fly Cruise program to enhance the travel experience.","Ponant Explorations features the luxury icebreaker Le Commandant Charcot, which can access remote parts of Antarctica, along with four other upscale expedition ships designed for such voyages.","Scenic Luxury Cruises & Tours has entered the luxury expedition market with its Scenic Eclipse and Scenic Eclipse II, which offer all-suite accommodations and unique features like onboard helicopters and submarines for excursions.","Atlas Ocean Voyages, launched in 2021, operates three 184-passenger ships designed for polar exploration, featuring upscale decor and amenities like L'Occitane-branded spas and heated outdoor seating areas.","Viking has introduced two new expedition ships, Viking Octantis and Viking Polaris, which include innovative features like an enclosed marina for easier passenger transfers and floor-to-ceiling glass walls in every cabin.","Seabourn has launched its first expedition cruise ships, Seabourn Venture and Seabourn Pursuit, which offer luxury accommodations and unique adventure features such as submarines for underwater exploration."
https://thepointsguy.com/hotel/most-anticipated-hotel-openings-2026/,These are the hotel openings TPG is most excited for in 2026,"In 2026, the hospitality industry will see significant hotel openings across various regions, including the U.S., Mexico, Europe, and Asia, many of which will be bookable using hotel loyalty points.","1 Hotel Austin is set to open in Spring 2026 in Austin, Texas, featuring a design that incorporates natural elements and a wellness-focused ethos, including a rooftop restaurant and a 16th-floor pool.","Delano Miami Beach will reopen in March 2026, bringing its historic design back to Miami Beach with modern updates, including new dining options like Gigi Rigolatto and Mimi Kakushi.","The Huntington Hotel in San Francisco will reopen in March 2026 after extensive renovations, featuring a spa, an indoor pool, and accommodations that blend historic architecture with modern design.","Public West Hollywood will open in Spring 2026 in the former The Standard, Hollywood location, offering 137 rooms, multiple dining options, and a large rooftop terrace.","Under Canvas will introduce two new glamping locations in Dalton, New Hampshire, and Groveland, California, in 2026, providing access to outdoor experiences while allowing bookings with Hyatt points.","Amanvari, the first Aman property in Mexico, is expected to open in Spring 2026 in Baja California Sur, featuring exclusive accommodations and a renowned spa."
