article_url,article_title,idea_1,idea_2,idea_3,idea_4,idea_5,idea_6,idea_7
https://liveandletsfly.com/united-mileageplus-credit-card-changes/,United Airlines Fundamentally Transforms MileagePlus With Credit Card–Driven Loyalty Strategy,"United Airlines has announced fundamental changes to its MileagePlus loyalty program, which will apply to tickets purchased on or after April 2, 2026, shifting the focus towards rewarding credit card holders over non-cardholders.","United Airlines will reduce the number of redeemable miles earned by MileagePlus members who do not hold a United co-branded credit card, effectively creating two classes of members with different earning rates.","United Airlines is eliminating mileage earning on Basic Economy fares for non-elite MileagePlus members unless they carry a United credit card, reinforcing the requirement for card ownership to earn miles on cheaper tickets.","United Airlines is introducing automatic award discounts of at least 10% for MileagePlus members who hold a United credit or debit card, making premium cabin award seats more accessible for cardholders.","United Airlines is allowing enhanced mileage earning and discounts on redemptions for both entry-level Chase cards and a new debit card, although both require a minimum annual spending to qualify.","United Airlines has fundamentally transformed the MileagePlus program to prioritize credit card adoption and spending, making it more of a financial product than a traditional loyalty program.","United Airlines has fundamentally changed the MileagePlus program, making it less rewarding for members without a United credit card and increasing the benefits for cardholders."
https://liveandletsfly.com/delta-flight-emergency-houston-disruptive-man-blouse/,"Delta Flight Declares Emergency, Returns To Houston After Disruptive Man In A Blouse Sparks Midair Chaos","A Delta Air Lines flight, Delta Flight 2557, was forced to make an emergency return to Houston after a male passenger wearing a blouse became disruptive shortly after takeoff.","The captain of Delta Flight 2557 declared an emergency and requested to return to Houston after the disruptive passenger approached the forward cabin area, prompting flight attendants to intervene.",Delta Air Lines confirmed that the cockpit door remained secure and was never breached during the incident involving a disruptive passenger on Flight 2557.,"Law enforcement and emergency personnel met Delta Flight 2557 upon its return to Houston, and the disruptive passenger was removed from the aircraft without further incident.",Delta Air Lines confirmed that law enforcement took the disruptive passenger into custody and reported no injuries among the 85 passengers or crew members on Flight 2557.,"The declaration of an emergency by the captain of Delta Flight 2557 was a procedural response to an onboard situation that introduced uncertainty or risk, rather than an indication of mechanical failure or imminent danger.","A disruptive passenger on Delta Flight 2557 caused a security concern shortly after takeoff, highlighting the ongoing rise in unruly passenger behavior on flights, as reported by the FAA since 2021."
https://liveandletsfly.com/tucker-carlson-detained-israel-ben-gurion/,Tucker Carlson Claims He Was “Detained” In Israel. That’s Not What Actually Happened.,,,,,,,
https://liveandletsfly.com/united-airlines-cfo-jetblue-merger/,United Airlines CFO Drops Biggest Hint Yet About JetBlue Merger,"Michael Leskinen, the Executive Vice President and Chief Financial Officer of United Airlines, hinted at United's interest in acquiring JetBlue during an interview at the Barclays 43rd Annual Industrial Select Conference on February 18, 2026.","Leskinen stated that the airline industry would benefit from mergers and acquisitions, suggesting a favorable environment for such actions, which could imply United's serious consideration of acquiring JetBlue.","Leskinen noted that the Trump administration's stance on mergers could influence the timing of a potential acquisition of JetBlue, as a Democratic administration in 2028 might oppose such a merger.","Leskinen confirmed that Pratt & Whitney powered 777s would be grounded in 2026, impacting United Airlines' international growth plans until the issue is resolved in 2027.","Leskinen expressed excitement about the 737 MAX 10 aircraft, indicating it is incrementally better for United Airlines' growth plans, although he stated that the airline's path to profitability is not solely dependent on it.","Leskinen made a remark about American Airlines' hub at Chicago O'Hare, stating, 'Temporarily, they have a hub,' which reflects United's competitive stance in the market.","As budget airlines struggle, United Airlines and Delta Air Lines are positioned to capitalize on the unique opportunities in the U.S. aviation industry, with speculation that United may pursue a merger with JetBlue in the near future."
https://liveandletsfly.com/malaysia-airlines-a330-900neo-business-class-review/,Review: Malaysia Airlines A330-900neo Business Class,"Matthew Klint enjoyed an excellent flight from Kuala Lumpur to Bali on a brand new Malaysia Airlines Airbus A330-900neo in business class, featuring a comfortable seat and excellent service onboard.","Matthew Klint booked his ticket for the flight using 22,000 British Airways Avios and $38 in taxes, while a paid ticket could cost over $500.","The business class cabin on the Airbus A330-900neo features 28 Collins Aerospace Elevation seats arranged in a 1-2-1 reverse herringbone pattern, with each seat offering 44 inches of pitch and the ability to convert into a fully lie-flat bed.","Each business class seat on the Malaysia Airlines A330-900neo features a 17.3-inch 4K touch screen display with a decent selection of content, but the inflight entertainment system is considered below average compared to competitors.","Malaysia Airlines provided a pre-departure beverage of apple juice and a cold towel, with breakfast options including Nasi Lemak and Roasted Chicken Thigh served promptly after takeoff.","The passenger to lavatory ratio in the business class cabin was excellent, with three lavatories available, and the lavatory was found to be clean with thicker paper towels provided.","Service on the flight was warm and attentive, highlighted by a particularly affable purser named Mr. Teck Hui, who engaged in a pleasant conversation about his extensive experience in the airline industry."
https://liveandletsfly.com/yale-professor-defense-of-robert-isom/,Yale Professor’s Defense Of American Airlines CEO Robert Isom Collapses Under Scrutiny,Yale management professor Jeffrey Sonnenfeld's opinion piece defending American Airlines CEO Robert Isom has been criticized for lacking factual support and failing to address the airline's significant labor issues.,"Dramatic headlines across business publications declare that there is a ""civil war"" within American Airlines, with union leaders expressing a lack of confidence in CEO Robert Isom.","American Airlines has not produced an annual loss during Robert Isom's tenure as CEO, even during the pandemic's impact in 2022, but comparisons to competitors Delta and United reveal significant profitability gaps.","American Airlines has a structural labor cost disadvantage compared to United Airlines, which currently enjoys a $1 billion-plus annual cost advantage due to outdated contracts with its labor groups.","American Airlines has more than 130,000 employees, with 87% unionized, and Isom's leadership has resulted in high contract ratification approval rates among flight attendants and mechanics, despite union criticisms.","American Airlines has faced unique challenges, including the largest weather-related operational disruption in its history during Winter Storm Fern in January 2026, which resulted in over 9,000 flight cancellations.","Robert Isom has made significant strides in reducing American Airlines' debt and investing in new aircraft, while also introducing innovative technologies for passenger services, although critics argue these efforts are not enough to improve the airline's competitive standing."
https://liveandletsfly.com/air-force-one-paint-job/,"Air Force One Is Getting Trump’s Red, White, And Blue Paint Job And Even Existing Jets Will Be Repainted",,,,,,,
https://viewfromthewing.com/comedian-jim-breuer-paid-for-first-class-from-hawaii-american-airlines-took-his-seat-for-a-pilot-and-moved-him-to-row-18/,Comedian Jim Breuer Paid For First Class From Hawaii—American Airlines Took His Seat For A Pilot And Moved Him To Row 18,"Comedian Jim Breuer purchased first class tickets on American Airlines for a flight from Honolulu to Fort Myers, Florida, but was downgraded to coach due to overbooking while two pilots took his seats in first class.",Jim Breuer expressed frustration that American Airlines did not inform him of his downgrade until the last minute and offered him a $500 voucher as compensation for the inconvenience of losing his first class seat.,"Jim Breuer criticized American Airlines for taking his paid first class seat and giving it to an employee, stating that he felt robbed of his ticket and money.","American Airlines' contract of carriage permits the airline to reassign a paid passenger's first-class seat to a pilot and offer compensation based on the fare difference, which comedian Jim Breuer found unacceptable.","A pilot took Jim Breuer's first class seat on an American Airlines flight because the airline needed to deadhead a pilot to Phoenix, which is allowed under their union contract.","Jim Breuer stated that he no longer has respect for the American Airlines supervisor, Mark, who handled his situation poorly and failed to provide adequate customer service after the incident.","Jim Breuer demanded a first class ticket for a future flight instead of a $500 voucher, arguing that his request was reasonable given the circumstances of his downgrade."
https://viewfromthewing.com/bilt-palladiums-delivered-50000-points-right-away-gold-secured-through-early-2028-and-4x-everyday-spend-strategy/,"Bilt Palladium’s Delivered 50,000 Points Right Away—Gold Secured Through Early 2028 And 4X Everyday Spend Strategy","Gary Leff received an initial bonus offer of 50,000 Bilt Points and Gold Status after spending $4,000 on everyday purchases within the first three months of using the Bilt Palladium Card.","The 50,000 Bilt Points were credited quickly to Gary Leff's account, helping him achieve a personal goal of accumulating over a million points in his Bilt account.","Gold status from the Bilt Palladium Card is valid for the remainder of the current year and the full next year, providing benefits such as free Go Puff delivery and higher Rent Day points transfer bonuses.","Gary Leff's current Platinum status, which he earned last year, is only valid for the current year, but he will have at least Gold status in 2027 if he does not earn Platinum again.","Gary Leff has been utilizing the benefits of both Gold and Platinum statuses, including priority check-in and boarding, free checked bags, and free exit row seats on Delta flights.","Gary Leff charged a Rakuten 'Incogni offer' to his Bilt Palladium Card, which allowed him to buy Bilt points at 1 cent each and earn additional points through the card's spending strategy.",There is a strategy to earn 4x points on all everyday spending with the Bilt Palladium Card.
https://viewfromthewing.com/he-checked-into-a-149-nyc-hotel-room-then-claimed-to-own-the-entire-skyscraper-eight-years-later-hes-guilty-of-fraud/,"He Checked Into a $149 NYC Hotel Room—Then Claimed To Own the Entire Skyscraper. Eight Years Later, He’s Guilty of Fraud",,,,,,,
https://viewfromthewing.com/singapore-promotes-americans-dating-aunties-yes-this-is-a-tourism-campaign-roundup/,"Singapore Promotes Americans Dating “Aunties”—Yes, This Is A Tourism Campaign [Roundup]",Singapore's Government is promoting a tourism campaign in America encouraging American men to come to Singapore to date Singaporean aunties.,,,,,,
https://viewfromthewing.com/report-hyatt-to-raise-award-prices-add-ultra-premium-795-credit-card-major-changes-could-hit-next-week/,"Hoax: Hyatt To Raise Award Prices, Add Ultra-Premium $795 Credit Card—Major Changes Could Hit Next Week",Hyatt is preparing a major overhaul of its loyalty program that may include higher award prices at top properties and the launch of a new $795 premium credit card designed to fast-track elite status.,"Hyatt's award chart is expected to expand from 8 tiers to 10 tiers, with Category 9 standard redemptions priced at 50,000 points per night and Category 10 at 60,000 points, along with variations for peak pricing.","Hyatt would make free night certificates more flexible by allowing category 1-4 certificates to book up to category 5 and category 1-7 certificates to expand to category 8, with the ability to top off certificates with additional points based on status.","Limited-service Hyatt brands would have up to 10 nights a year designated as more expensive than peak pricing for their category, with redemption pricing tied to a fixed 1.5 cents per point floor until reaching peak pricing.","Starting February 2028, confirmed suites could only be combined with points stays for Explorists and higher, but Explorists would not be able to do this on category 8, 9, or 10 hotels redeemed with points.","Hyatt's renewal of its cobrand card agreement with Chase will introduce a new premium credit card featuring an initial bonus of 100,000 points, an annual fee of $795, and benefits such as Explorist status and 20 elite nights each year.","Hyatt is committed to an award chart that will continually devalue, with anticipated award inflation and changes expected to be announced at the end of February."
https://viewfromthewing.com/hyatt-cards-big-bonus-ends-feb-26-how-15k-in-spend-turns-into-7-free-nights/,Hyatt Card’s Big Bonus Ends Feb 26 — How $15K In Spend Turns Into 7 Free Nights,,,,,,,
https://viewfromthewing.com/americas-smallest-bank-lounge-how-to-get-into-the-78-seat-chase-sapphire-lounge-phoenix-without-waiting/,America's Smallest Bank Lounge—How To Get Into The 78-Seat Chase Sapphire Lounge Phoenix Without Waiting,,,,,,,
https://viewfromthewing.com/stunk-the-entire-flight-american-airlines-flight-attendant-shocked-by-foot-odor-so-bad-passenger-hid-under-a-blanket-roundup/,‘Stunk The Entire Flight’: American Airlines Flight Attendant Shocked By Foot Odor So Bad Passenger Hid Under A Blanket [Roundup],An American Airlines flight attendant described a passenger's foot odor as 'straight-up aggressive' and noted that the smell was present throughout the entire flight.,The flight attendant reported feeling nauseous from the odor and had to hold her breath while passing the passenger's row.,"A passenger sitting a row ahead of the man with the foot odor covered her head with a blanket for most of the flight, likely due to the smell.",Another crew member approached the flight attendant after passing the passenger's row and expressed surprise at the odor.,,,
https://viewfromthewing.com/surveillance-video-shows-tucker-carlson-lied-about-being-detained-by-israeli-security/,Surveillance Video Shows: Tucker Carlson Lied About Being ‘Detained’ By Israeli Security,,,,,,,
https://viewfromthewing.com/jetblue-passenger-abandons-fake-service-dog-at-airport-when-told-he-couldnt-fly-hell-find-his-way-home/,JetBlue Passenger Abandons Fake Service Dog At Airport When Told He Couldn't Fly: “He'll Find His Way Home”,"A passenger at Harry Reid International Airport in Las Vegas attempted to fly with a 2-year-old goldendoodle mini-poodle mix dog as a service animal without completing the required online paperwork, leading JetBlue to inform her that she needed to pay a $150 pet fee for the dog to travel in the cabin.",Surveillance video shows the passenger securing the dog to a baggage sizer near the JetBlue ticket counter before leaving the dog behind and proceeding to her gate.,"Las Vegas Metropolitan Police Department officers responded to a report of an abandoned dog after a JetBlue passenger left her dog behind at the airport, stating that the airline would not allow her to fly with it and believing the dog had a tracking device to find its way home.","The passenger was taken back through the security checkpoint, became hostile, and was subsequently arrested for animal abandonment and resisting arrest, later being released on her own recognizance with a court hearing scheduled for March 31.","Animal Protective Services took custody of the abandoned dog, which underwent a mandatory 10-day holding period, after which the owner did not reclaim him, leading Retriever Rescue of Las Vegas to take custody, rename him Jet Blue, neuter and vaccinate him, and place him in foster care while seeking a permanent home.","Previous incidents of animal abandonment at airports include a woman who left her dog at Pittsburgh airport to fly to Mexico, and another who abandoned her dog in a bathroom at Orlando airport after being informed by Southwest Airlines that it could not fly.","Emotional support animals are no longer allowed on flights, but service animals require paperwork, and a passenger's failure to complete this paperwork caused a Delta flight to return to the gate, resulting in a delay for refueling."
https://www.flightglobal.com/aerospace/airbus-not-supporting-urals-a320-family-life-extension-effort/166390.article,Airbus not supporting Ural’s A320-family life-extension effort,"Ural Airlines has disclosed plans to extend the service life of its Airbus A320-family aircraft to more than 96,000 flight hours, but Airbus is not supporting these efforts for Russian operators due to an embargo imposed by the European Union.",Airbus has halted the supply of service bulletins and retrofit parts for A320-family aircraft registered in Russia since the embargo was enacted.,"Ural Airlines is planning to extend the service life of its Airbus A320-family aircraft through its own aviation technical centre, but it is unclear whether this program will be limited to its fleet or will also include third-party aircraft.","Airbus's Extended Service Goal program, initiated in 2007, allows operators to increase the safe airworthiness life of A320-family aircraft from 60,000 flight hours to 120,000 flight hours and the number of cycles from 48,000 to 60,000, potentially providing an additional 10-20 years of service.","Airbus had initially planned a further phase of the Extended Service Goal program, known as ESG II, which would have extended the aircraft life up to 180,000 flight hours, but the company abandoned this plan around the time the A320neo entered service.",,
https://www.flightglobal.com/news/air-france-klm-eyes-777-300er-replacement-sooner-rather-than-later/166374.article,Air France-KLM eyes 777-300ER replacement ‘sooner rather than later’,"Air France-KLM is likely to soon decide on replacing its ageing Boeing 777-300ER aircraft as part of a group-wide fleet transformation effort, according to group chief executive Ben Smith.",Air France-KLM is considering replacing its Boeing 777-300ER aircraft with either the Airbus A350-1000 or the yet-to-be-certified Boeing 777-9.,"Air France-KLM currently operates 59 Boeing 777-300ERs, with 43 assigned to Air France and 16 to KLM, and the highest-density cabin configuration features 472 seats primarily used on leisure routes by Air France.","Air France-KLM has been taking Airbus A350-900s and -1000s to replace its A330s and 777-200ERs, following a deal for 50 of the type signed in 2023.","Air France has been operating Airbus A350-900s since 2019, while KLM is set to receive its first delivery of the type this year.","Air France is replacing all of its A320ceo-family jets with Airbus A220s, expecting to have 90-95 A220s in its fleet by the end of the decade.","Air France-KLM reported annual revenues of €33 billion ($39 billion) in 2025, with a net income of €1.75 billion, which included nearly €700 million in unrealised foreign exchange gains."
https://www.flightglobal.com/airlines/flyarystan-picks-former-wizz-air-executive-as-new-president/166366.article,FlyArystan picks former Wizz Air executive as new president,"Air Astana Group has appointed former Wizz Air executive Johan Eidhagen as the new president of its low-cost unit FlyArystan, effective 1 March.","Johan Eidhagen previously oversaw operations at Wizz Air's now-closed Abu Dhabi operations and held senior leadership roles, including chief marketing officer, at Wizz Air Group.","Eidhagen will replace Richard Ledger, who is returning to Air Astana Group to lead the newly-created partnerships and alliances department.",Richard Ledger joined FlyArystan in 2024 and will focus on developing codeshare opportunities to access larger markets in the region.,"FlyArystan, headquartered in Almaty, launched operations in 2019 and currently operates a fleet of Airbus A320 aircraft.",The leadership change at FlyArystan coincides with the retirement of Air Astana Group's long-serving chief Peter Foster at the end of March.,"Air Astana has finalized an order for up to 15 Boeing 787-9 aircraft, including firm orders for five jets and options for five more."
https://skift.com/2026/02/20/best-in-hospitality-winter-2026-new-brands-and-ideas-that-matter/,Best in Hospitality Winter 2026: New Brands and Ideas That Matter,"Luxury hospitality is shifting from flashy displays to deeper, sensory-driven experiences that prioritize guest connection and individuality.","Key brands and projects such as Airelles Venice, Zannier, Trunk Hotels, and Nihi Rote are expanding globally with a focus on design integrity, service culture, and innovative guest programming.","Emerging trends in the hospitality industry include elevated wellness offerings, sustainable tourism strategies, thoughtful renovations, and a call for more meaningful intellectual and social programming in hotels.",,,,
https://aviationweek.com/air-transport/airports-networks/routes-networks-latest-rolling-daily-updates-wc-february-16-2026,"Routes & Networks Latest: Rolling Daily Updates (W/C February 16, 2026)","Air Canada has expanded its presence in Turkey through a new interline partnership with Pegasus Airlines, allowing customers to book travel on nine Pegasus-operated routes to Istanbul Sabiha Gokcen International Airport and Izmir Adnan Menderes Airport via major European gateways.","Jet2.com has announced an expanded summer 2027 program from London Gatwick Airport, increasing capacity by 27% and launching a new weekly service to Lesvos, Greece.","Peru and Spain have signed a new air services agreement that eliminates capacity restrictions, allowing airlines to operate under a fully liberalized regime and reflecting sustained traffic growth between the two countries.","Avianca has opened sales for a new daily nonstop service between Medellín and Pasto, set to operate from March 29 using Airbus A320-family aircraft.","Canada's Air Transat has launched several new seasonal sun routes, including weekly service between Quebec City and Pointe-a-Pitre, Windsor and Punta Cana, and Charlottetown and Cancun.","GOL Linhas Aéreas will expand its footprint in northern Brazil with new nonstop routes linking Manaus to Fortaleza and Boa Vista, while increasing capacity from Boa Vista to Brasilia.","JetBlue is resuming nonstop service between Houston's George Bush Intercontinental Airport and New York's John F. Kennedy International Airport beginning May 21, offering 2X-daily flights."
https://aviationweek.com/aerospace/aircraft-propulsion/southwest-concerned-over-potential-cfm-leap-parts-crunch,Southwest Concerned Over Potential CFM Leap Parts Crunch,Southwest Airlines is concerned that the narrowbody engine market will become even tighter due to a new durability issue with the CFM International Leap-1B family of engines.,CFM International has notified operators that the life limits for the Leap-1B engines are nearing a critical threshold for parts replacement.,,,,,
https://aviationweek.com/aerospace/aircraft-propulsion/flight-friday-north-american-airlines-shift-modern-widebodies,Flight Friday: North American Airlines Shift To Modern Widebodies,"North American airlines, including Air Canada, American Airlines, Delta Air Lines, and United Airlines, are placing significant orders for modern widebody aircraft such as Airbus A350s and Boeing 787s to replace their older fleets of A330s, 767s, and 777s.","In 2023, total annual widebody utilization for major North American airlines exceeded 2019 levels, with the Boeing 777 accounting for 31% of flight cycles and the Boeing 767 dropping to 21%.","By 2025, the Boeing 777 remains the most utilized aircraft at North American airlines, with only a one percentage point lead over the Boeing 787, while the Airbus A350 has increased its share to 5% of annual utilization.","Delta Air Lines has introduced additional Airbus A330-900s into its fleet, resulting in a 17% utilization rate for the Airbus A330.",,,
https://aviationweek.com/air-transport/airlines-lessors/benin-regulator-greenlights-aoc-new-carrier,Benin Regulator Greenlights AOC For New Carrier,"Amazone Airlines has received its air operator's certificate (AOC) from the aviation regulator of Benin, allowing the new national airline to begin operations.",,,,,,
