article_url,article_title,idea_1,idea_2,idea_3,idea_4,idea_5,idea_6,idea_7
https://thepointsguy.com/news/united-airlines-mileageplus-miles-shakeup/,"United unveils huge MileagePlus shakeup, rewarding cardholders with higher earn rates",United Airlines announced changes to its MileagePlus program that will benefit credit card holders while making it harder for non-cardholders to earn miles.,"United Airlines will reduce the mileage earning rates for members without status or a United credit card, while increasing the earning potential for cardholders and Premier status members.","United Airlines will offer credit card holders discounts of at least 10% on every award flight, with greater discounts for those with Premier status, effective for tickets purchased on or after April 2.",United Airlines will implement a new policy that prevents customers booking basic economy fares from earning MileagePlus miles unless they have elite status or a United credit card.,"Beginning April 2, United Airlines will bar most passengers from earning miles on basic economy tickets, while still allowing Premier elite status members and eligible credit card holders to earn at reduced rates.","United Airlines is now the only U.S. airline that prohibits most passengers from bringing a full-size carry-on bag on basic economy tickets, with exceptions for cardholders and Premier status members.","United Airlines follows Delta Air Lines and American Airlines in restricting mileage earning on basic economy bookings, although United flyers will still earn Premier qualifying points on these fares."
https://thepointsguy.com/credit-cards/bank-of-america-new-rewards-program/,Bank of America expands rewards access with new no-fee loyalty program,"Bank of America will launch a new loyalty program called BofA Rewards on May 27, which will not require members to maintain a minimum balance to join.","BofA Rewards will allow personal account holders who previously did not meet the $20,000 balance requirement for the Preferred Rewards program to earn additional benefits.","Current Preferred Rewards members may experience changes to their perks under the new BofA Rewards program, with different tier thresholds and benefits.","The BofA Rewards program will have four tiers: Member, Preferred Plus, Preferred Honors, and Premier, each with specific benefits based on total assets.","Existing Preferred Rewards members will be automatically enrolled in BofA Rewards on May 27, with their current benefits remaining in place for at least six months.","Members of the BofA Rewards program can earn varying credit card rewards bonuses based on their tier, with potential earnings of up to 2.625% cash back on everyday purchases.","BofA Rewards is particularly advantageous for new members who previously could not access Bank of America's loyalty program, despite some downsides for current Preferred Rewards members."
https://thepointsguy.com/credit-cards/credit-card-travel-perks/,9 valuable travel perks that you can get with a credit card,"Premium travel credit cards provide valuable travel perks such as travel and rental car insurance, airport lounge access, and travel-focused annual statement credits.","The Capital One Venture X Rewards Credit Card offers complimentary access to Capital One Lounges and a welcome bonus of 75,000 bonus miles after spending $4,000 in the first three months.","The Chase Sapphire Reserve card provides access to an expansive lounge network through a Priority Pass Select membership and a welcome offer of 125,000 bonus points after spending $6,000 in the first three months.","The Capital One Venture Rewards Credit Card offers a credit of up to $120 for Global Entry or TSA PreCheck, along with at least 2 miles per dollar spent on every purchase.",The Bank of America Premium Rewards credit card provides a TSA PreCheck/Global Entry statement credit of up to $100 every four years.,"The Chase Sapphire Reserve and Chase Sapphire Preferred cards offer primary rental car insurance on most rentals, along with other travel credits.",The Delta SkyMiles Gold American Express Card and the United Explorer Card provide complimentary checked bags for cardholders and their traveling companions.
https://thepointsguy.com/news/american-airlines-tweaks-checked-baggage-policy/,American Airlines tweaks bag fees: Why you'll definitely want to plan ahead,"American Airlines announced an increase in fees for passengers' second checked bag to $50 if paid at the airport, up from $45, while maintaining a $45 fee for those who prepay online before their trip.","American Airlines' first checked bag fee remains unchanged at $35 if prepaid online and $40 if paid at the airport, while the second checked bag fee will be $45 if prepaid online and $50 at the airport.","American Airlines aims to encourage travelers to prepay for their second checked bag to reduce check-in and bag-drop lines inside the terminal, similar to its current policy for the first checked bag.",American Airlines has enhanced its mobile app and online tools to facilitate easier baggage addition and flight changes for customers.,"Heather Garboden, American Airlines' Chief Customer Officer, emphasized that making the travel experience more streamlined and convenient before arriving at the airport benefits customers.","American Airlines is increasing the fee for a second checked bag to $50 at the airport, which is $5 more than the previous charge, as part of a broader trend in the airline industry following a significant drop in the airline's profits reported for 2025.",
https://thepointsguy.com/travel/best-places-in-the-world-to-see-cherry-blossoms/,The 12 best places to see cherry blossoms abroad this spring,,,,,,,
https://thepointsguy.com/credit-cards/ihg-rewards-credit-card-offers/,"Earn up to 175,000 points with these limited-time IHG Rewards card offers",,,,,,,
https://thepointsguy.com/news/virgin-atlantic-transfer-bonus-partner-redemptions/,"With a 40% transfer bonus from Chase to Virgin Atlantic, here’s why redemptions on partner airlines can make the most sense","Chase Ultimate Rewards program is offering a 40% transfer bonus to Virgin Atlantic's Flying Club program until February 28, 2026, allowing every 1,000 Ultimate Rewards points to become 1,400 Virgin points.","Virgin Atlantic has shifted to dynamic pricing for its own flights, resulting in high redemption rates on peak dates and popular routes, especially in premium cabins.","Virgin Atlantic Flying Club's partner airline redemptions follow traditional award charts, providing more predictable pricing, wider availability, and lower surcharges compared to Virgin-operated flights.","Air France business class from Detroit to Paris can be booked for 58,500 Virgin points plus $302 in taxes and fees, requiring a transfer of just 42,000 Chase Ultimate Rewards points with the current transfer bonus.","SAS premium economy flights from Atlanta to Copenhagen can be booked for 47,500 Virgin points plus $5.60 in taxes and fees, needing a transfer of 34,000 Chase points with the transfer bonus.","LATAM business class from New York to Lima, Peru can be booked for 50,000 Virgin points plus $55 in taxes and fees, requiring a transfer of just 36,000 Chase points with the 40% transfer bonus.","Delta business class flights from Seattle to Seoul, South Korea can be booked for 130,000 Virgin points plus $5.60 in taxes and fees, requiring a transfer of 93,000 Chase points with the bonus."
https://thepointsguy.com/cruise/howto-antarctica-fly-cruise/,How to get to Antarctica: The pros and cons of flying vs. cruising,,,,,,,
https://thepointsguy.com/credit-cards/who-should-get-amex-gold-card/,Who should (and who shouldn’t) get the Amex Gold?,"The American Express® Gold Card has popular bonus categories for dining at restaurants and U.S. supermarkets, earning valuable American Express Membership Rewards points, and its $325 annual fee can be offset by utilizing various statement credits and benefits.","The Amex Gold offers up to $424 in annual value through statement credits for dining, Uber Cash, and Resy, which can help users cover the card's annual fee.","The Amex Gold allows cardholders to earn 4 points per dollar spent at restaurants and U.S. supermarkets, 3 points per dollar on flights booked directly with airlines or through AmexTravel.com, and 2 points per dollar on prepaid hotels booked through AmexTravel.com.","Individuals who spend heavily on dining and groceries can benefit significantly from the Amex Gold due to its high earning potential in these categories, offering an 8% return based on Membership Rewards point valuation.",People who have reached the 5/24 limit with Chase may find the Amex Gold a suitable next step to earn transferable rewards currency and bonuses more quickly.,"Individuals who have previously earned a bonus on the Amex Gold or its predecessor will not be eligible for another welcome bonus, making it advisable to consider other cards for those who have had it before.","The Amex Gold lacks comprehensive travel protections compared to other premium cards, making it less suitable for those prioritizing travel insurance and protections."
https://onemileatatime.com/news/palm-beach-airport-renamed-donald-trump/,Palm Beach International Airport (PBI) Will Be Renamed After Donald Trump,"Florida lawmakers have proposed renaming Palm Beach International Airport to Donald J. Trump International Airport, and this proposal has passed the Florida Legislature.","Republican Florida State Representative Meg Weinberger introduced the proposal in November 2025, stating that President Trump is the most consequential president of our lifetime and a resident of Palm Beach County.","The Florida Legislature voted 81-30 in the House and 25-11 in the Senate to approve the renaming, and Florida Governor Ron DeSantis is expected to sign off on it, with the renaming set to take effect on July 1, 2026.","Approximately $5.5 million has been allocated for the implementation of the renaming, which includes updated signage and branding.","In February 2025, Meg Weinberger co-sponsored a bill to rename a four-mile stretch of Southern Boulevard in Palm Beach County after Donald Trump.","Donald Trump has filed several applications to the US Patent and Trademark Office for variations of names that airports could use, including the name proposed for Palm Beach International Airport.","Currently, more than 10 commercial airports in the United States are named after former presidents, including John F. Kennedy Airport in New York and Ronald Reagan National Airport in Washington."
https://onemileatatime.com/news/rumored-world-of-hyatt-program-changes-fake/,Rumored World Of Hyatt Program Changes Are Completely Fake?!?,A Reddit user who initially posted rumors about changes to the World of Hyatt loyalty program now claims that those details were fabricated as part of a college experiment to study the spread of misinformation online.,The Reddit user stated that the original post was designed to see how easily plausible unverified information could circulate when it includes insider language and operational details.,"The Reddit user expressed surprise at how quickly travel blogs picked up the fabricated rumors as headlines, indicating the high level of interest in Hyatt program changes.","Many people are invested in loyalty programs like World of Hyatt, leading to a strong desire for updates and rumors, which can sometimes result in the spread of unverified information.","There is skepticism about the authenticity of the Reddit user's claim that the original post was a lie, suggesting that there may be more to the situation than what has been disclosed.",The situation surrounding the World of Hyatt rumors raises questions about the responsibility of bloggers and the impact of unverified information on public perception.,The Reddit user apologized for causing anxiety among those who believed the rumors about the World of Hyatt program changes.
https://onemileatatime.com/news/comedian-slams-american-airlines-pilot-steals-first-class-seat/,Comedian Slams American Airlines After Pilot “Steals” First Class Seat,Comedian Jim Breuer expressed anger after being downgraded from first class to economy on an American Airlines flight from Honolulu to Phoenix due to overbooking.,"Jim Breuer and his wife were informed at the gate that two pilots in uniform had taken their first class seats, leading to their downgrade to row 18.","Jim Breuer rejected a $500 compensation offer from American Airlines, feeling it was insulting compared to the thousands spent on their first class tickets.",Jim Breuer claimed that pilots at American Airlines should not take seats from paying passengers and became obsessed with the situation after feeling violated.,"American Airlines pilots are entitled to first class seating on flights between Hawaii and the mainland due to their deadheading policy, which allows them to bump paying passengers.",The gate agent's unclear communication about the overbooking situation contributed to comedian Jim Breuer and his wife's feelings of being 'stolen' from when they were downgraded from first class to economy.,"Many U.S. airlines, including American Airlines, have similar policies regarding deadheading pilots, which can lead to downgrades for paying passengers."
https://onemileatatime.com/news/emirates-reconfiguring-airbus-a380-highest-capacity-plane/,Emirates Reconfiguring 615-Seat Airbus A380 (World’s Highest Capacity Plane),Emirates is undergoing a retrofit project for its Airbus A380 aircraft to introduce a new product standard and roll out premium economy seating.,"Emirates' densest Airbus A380s will be reconfigured from 615 seats to 569 seats, with an increase in business class seats from 58 to 76 and the introduction of 56 premium economy seats.",The reconfiguration will reduce economy class seating from 557 to 437 seats on Emirates' high density Airbus A380s.,"The upper deck of Emirates' A380s will be entirely dedicated to premium seating, with 76 business class seats and 56 premium economy seats replacing the previous first class cabin.",Emirates is responding to increased global demand for premium travel by rethinking the layout of its high density Airbus A380s to better reflect current travel trends.,"Emirates' premium economy seating will be located at the front of the upper deck, providing a more desirable layout compared to the previous configuration.","The overall changes to Emirates' A380 fleet aim to enhance flexibility for longer, more premium routes by standardizing the number of business class seats across the fleet."
https://onemileatatime.com/news/world-of-hyatt-premium-credit-card/,"Rumor: Details Of New Premium World Of Hyatt Credit Card, With $795 Fee","Chase and Hyatt plan to introduce a new premium personal credit card with Park Hyatt branding, which has been rumored for a long time.","The rumored new World of Hyatt credit card will have a $795 annual fee, an initial sign-up bonus of 100,000 bonus points, and automatic Explorist status.","The new credit card will offer a Category 1-5 free night award annually, 20 elite nights toward status just for having the card, and 10 elite nights for every $15,000 spent.",The card will provide a $200 Hyatt statement credit twice per year and will earn 10x points on Hyatt purchases and 3x points on dining and direct airline bookings.,"The new World of Hyatt premium credit card will create a much faster pathway to Globalist status, offering 20 elite nights annually compared to five on the existing personal card.","The new World of Hyatt premium credit card will simplify the process of earning Globalist status, potentially increasing competition for suite upgrades.","The new premium World of Hyatt credit card will feature significant perks, including a shortcut to Globalist status and up to $400 in annual credits, with a $795 annual fee, although official details have not yet been announced."
https://onemileatatime.com/news/world-of-hyatt-award-pricing-changes/,"Rumor: World Of Hyatt Plans Category 10 Hotels, Super Peak Award Pricing","World of Hyatt may be planning significant changes to its award redemption rates, aiming to improve the economics of its loyalty program.","World of Hyatt plans to introduce Category 9 and Category 10 hotels, with Category 9 properties costing 50,000 points per night and Category 10 properties costing 60,000 points per night.","World of Hyatt is expected to implement a new 'super peak' award pricing for select service brands during high demand periods, allowing for higher redemption costs.","World of Hyatt plans to enhance free night awards by changing Category 1-4 free night awards to Category 1-5 and Category 1-7 free night awards to Category 1-8, along with introducing a top-off functionality for these awards.","World of Hyatt plans to introduce Category 9 and Category 10 hotels and implement super peak award pricing to enhance the economics of its hotel loyalty program, especially during peak periods.","World of Hyatt plans to introduce significant changes to its award pricing structure, including the addition of Category 9 and 10 hotels and the implementation of super peak pricing.","Anticipated changes to the World of Hyatt program, including the introduction of Category 9 and 10 hotels and super peak award pricing, may negatively impact members despite planned improvements to free night awards."
https://onemileatatime.com/news/most-powerful-flight-attendant-praises-american-ceo-robert-isom/,World’s Most Powerful Flight Attendant Praises American CEO Robert Isom,"American Airlines CEO Robert Isom has faced criticism for the airline's performance compared to competitors Delta and United, particularly regarding profitability and passenger experience.","Sara Nelson, the President of the Association of Flight Attendants, praised Robert Isom's leadership and commitment to frontline employees during the announcement of a new contract for PSA flight attendants.","PSA flight attendants have reached a tentative agreement that includes a 10% immediate wage increase, additional compensation through boarding pay, retro pay, and improved scheduling and flexibility.","Sara Nelson, President of the Association of Flight Attendants, praised American Airlines CEO Robert Isom for his commitment to frontline employees in the context of a new contract announcement for PSA flight attendants, which is unusual in labor negotiations.","Sara Nelson, President of the Association of Flight Attendants, praised American Airlines CEO Robert Isom for his commitment to frontline employees, contrasting his leadership with the contentious labor negotiations at United Airlines.","American Airlines management, including Robert Isom and former CEO Doug Parker, has been noted for being more labor-friendly compared to management at United Airlines.","Sara Nelson, President of the Association of Flight Attendants, praised American Airlines CEO Robert Isom for his commitment to employees, which is seen as a strategic move to challenge United CEO Scott Kirby during ongoing contract disputes with United flight attendants."
https://onemileatatime.com/news/w-hotel-amsterdam-eviction-not-paying-rent/,W Hotel Amsterdam Faces Eviction After Not Paying Rent For Three Years,,,,,,,
https://liveandletsfly.com/newlyweds-in-business-class/,A Note To The Newlyweds In Business Class On My Malaysia Airlines Flight,"A young Indian couple seated in business class on a Malaysia Airlines A330-900neo flight from Kuala Lumpur to Bali displayed affection during their honeymoon, with the husband attentively checking on his wife and showcasing the seat features.","The husband frequently asked his wife if she was comfortable, enjoyed the food, needed drinks, or required a pillow or blanket, demonstrating his care and attention.","The wife appeared to be an experienced traveler, managing her in-flight entertainment and locating her blanket and pillow without assistance from her husband.","As Matthew Klint approaches his 12th wedding anniversary, he reflects on the importance of kindness in a relationship, recalling his early marriage experiences with his wife, Heidi.","Matthew Klint advises newlyweds to prioritize forgiveness, love, goal-setting, and to enjoy their honeymoon despite life's busyness.","Children bring happiness, but there is never an ideal time to start a family, so couples should respect and support each other's dreams and aspirations.","Matthew Klint aims to become a wiser and kinder husband, inspired by a young couple's love and his own memories of early marriage."
https://liveandletsfly.com/world-of-hyatt-changes-2026/,"Fake News: Category 10 Hotels, Super Peak Pricing, And A $795 Premium Credit Card Could Redefine World of Hyatt",Matthew Klint stated that the rumored changes to the World of Hyatt program were not a leak from Hyatt but rather part of a college experiment to see how easily unverified information spreads online.,"World of Hyatt may introduce two new award chart tiers, Category 9 at 50,000 points per night and Category 10 at 60,000 points per night, significantly increasing the cost of redemptions.","Category 10 may be exclusive to a very small number of Park Hyatt properties, with Park Hyatt Kyoto potentially being the only Category 10 property at rollout.","A reshuffling of categories 6 through 8 is expected, with major metro Park Hyatt hotels in Paris and Tokyo likely to move up to Tier 9, leading to increased redemption costs for those properties.","The introduction of 'Super Peak' nights would tie award pricing during high-demand periods to a fixed 1.5 cents per point floor, potentially increasing costs for World of Hyatt members.","Hyatt may expand its free night certificate offerings and introduce new ways to ""top off"" awards, potentially providing members with greater flexibility in using points as costs rise.","The new premium World of Hyatt cobranded credit card has a $795 annual fee, offers a sign-up bonus of 100,000 points, provides various benefits, and still requires 20 qualifying nights to achieve Globalist status."
https://liveandletsfly.com/sara-nelson-robert-isom/,World’s Powerful Flight Attendant Heaps Effusive Praise On American Airlines CEO…,"Sara Nelson, President of the Association of Flight Attendants, praised American Airlines CEO Robert Isom for his commitment to frontline employees after PSA flight attendants secured a tentative agreement for wage increases of up to 50%.","Sara Nelson's praise for Robert Isom contrasts with her criticism of United Airlines CEO Scott Kirby, as United flight attendants remain without a new contract and are still receiving 2019 wages.","Despite the praise for Isom, Nelson's comments may also serve as a subtle dig at Scott Kirby, who has not directly engaged in negotiations for a new contract for United flight attendants.","Nelson's team previously negotiated a deal for United flight attendants that was rejected, raising questions about whether the failure lies with United Airlines or the union's leadership.","Robert Isom has not imposed additional demands on flight attendants while negotiating generous contracts for PSA flight attendants, which some view as beneficial for labor.","Sara Nelson's praise of Isom may reflect a pragmatic view that he is the best leader labor can hope for, despite potential negative impacts on American Airlines' financial performance.","The timing of Nelson's praise for Isom coincides with discussions about inter-union dynamics and employee satisfaction, suggesting a complex relationship between the unions and airline management."
https://liveandletsfly.com/jetblue-service-dog-incident/,JetBlue Passenger Abandons Her “Service Dog” At Las Vegas Airport After Paperwork Dispute,A woman was arrested at Harry Reid International Airport in Las Vegas after she allegedly left her dog inside the terminal and continued on toward her flight when JetBlue staff told her she could not board with it.,"On February 2, 2026, a passenger attempted to check in with a dog she claimed was a service animal, but JetBlue employees informed her that she had not completed the required service animal documentation, leading her to abandon the dog tied to a baggage sizer.","A woman was arrested at Harry Reid International Airport for abandoning her dog after JetBlue staff informed her that she could not board with it due to incomplete service animal documentation, and when confronted by police, she claimed the dog would ""find its way home"" and had a tracking device installed, but became hostile.","After the woman was arrested, airport staff and local authorities took the dog into care, and it was later placed with a local rescue organization where it received overwhelming adoption interest.","Traveling with a pet requires planning and a commitment to care for the animal, as demonstrated by a woman who abandoned her dog at Las Vegas Airport after failing to complete the necessary service animal documentation.","A woman was arrested at Harry Reid International Airport for abandoning her dog after being denied boarding on a JetBlue flight due to incomplete service animal documentation, but the dog was later rescued and placed with a local organization where it is expected to find a loving home.",
